key,title,libraryCatalog,status,analise
QRHHQGRN,Detecting Workload-based and Instantiation-based Economic Denial of Sustainability on 5G Environments,ACM Digital Library,Rejeitado,Fora do Escopo
KNHD2364,A New Online Anomaly Learning and Detection for Large-scale Service of Internet of Thing,ACM Digital Library,Rejeitado,Fora do Escopo
GSHYF6PF,Security camera movie and ERP data matching system to prevent theft,Google Scholar,Rejeitado,Fora do Escopo
FT9HML9Z,Intelligent Crash Detection and Emergency communication system for Two Wheelers,IEEE Xplore,Rejeitado,Fora do Escopo
LI88ASCM,Actionable Knowledge As A Service (AKAAS): Leveraging big data analytics in cloud computing environments,Springer Link,Rejeitado,Fora do Escopo
6RMQSXVT,Blockchain-based cloudlet management for multimedia workflow in mobile cloud computing,Springer Link,Rejeitado,Fora do Escopo
ZU97I9JB,An intrusion detection system for connected vehicles in smart cities,ScienceDirect,Rejeitado,Fora do Escopo
8XG6CH8R,Intrusion detection systems for IoT-based smart environments: a survey,Springer Link,Rejeitado,Fora do Escopo
JU9X9Q9Y,Establishing safe cloud: Ensuring data security and performance evaluation,Google Scholar,Rejeitado,Inacessível
E3CKAID8,Performance Analysis of Large Scale Distributed Systems by Ranking Dominant Features,ACM Digital Library,Rejeitado,Fora do Escopo
57MJSBRI,Industry 4.0 and cloud computing,Google Scholar,Rejeitado,Não Artigo
Q9Z8C9P7,Using genetic algorithms to find optimal solution in a search space for a cloud predictive cost-driven decision maker,Springer Link,Rejeitado,Fora do Escopo
ZAL5IAXQ,Detecting cyber-physical attacks in CyberManufacturing systems with machine learning methods,Google Scholar,Rejeitado,Fora do Escopo
4TL3EZBY,Complexity vs. Performance: Empirical Analysis of Machine Learning As a Service,ACM Digital Library,Rejeitado,Fora do Escopo
BHZD5LUP,Intrusion detection systems in the Internet of things: A comprehensive investigation,ScienceDirect,Rejeitado,Fora do Escopo
8LQS3PMF,Efficient cloud storage confidentiality to ensure data security,Google Scholar,Rejeitado,Fora do Escopo
3R2ZY8S8,Machine learning in the Internet of Things: Designed techniques for smart cities,ScienceDirect,Rejeitado,Fora do Escopo
P3CJ3NMB,XSSClassifier: An Efficient XSS Attack Detection Approach Based on Machine Learning Classifier on SNSs.,Google Scholar,Rejeitado,Fora do Escopo
KBXJA6UT,A cloud computing based network monitoring and threat detection system for critical infrastructures,Google Scholar,Rejeitado,Fora do Escopo
W9IPYFU2,Nearby live virtual machine migration using cloudlets and multipath TCP,Springer Link,Rejeitado,Fora do Escopo
D5KMN985,"Towards Evolutionary Machine Learning Comparison, Competition, and Collaboration with a Multi-cloud Platform",ACM Digital Library,Rejeitado,Fora do Escopo
9H2X32UE,CloudI: Cloud Security Based on Cloud Introspection,ACM Digital Library,Rejeitado,Fora do Escopo
S6VPLM4N,Dynamic IoT Management System Using K-means Machine Learning for Precision Agriculture Applications,ACM Digital Library,Rejeitado,Fora do Escopo
6WYVSUKR,"IntelliMaV: A cloud computing measurement and verification 2.0 application for automated, near real-time energy savings quantification and performance deviation detection",ScienceDirect,Rejeitado,Fora do Escopo
6ZBGYGIR,A Global Manufacturing Big Data Ecosystem for Fault Detection in Predictive Maintenance,IEEE Xplore,Rejeitado,Fora do Escopo
2DIPPMC5,Guest Editorial Special Issue on Cloud Computing for IoT,IEEE Xplore,Rejeitado,Fora do Escopo
ICWEQ38M,A Study on Machine Learning Based Generalized Automated Seizure Detection System,IEEE Xplore,Rejeitado,Fora do Escopo
EZ5LVBJ8,MTBAC: A mutual trust based access control model in cloud computing,Google Scholar,Rejeitado,Fora do Escopo
